{
  "schemaVersion": 1,
  "id": "0192f7a4-6c1e-7b3a-9d2e-5f8a1c3b7e91",
  "title": "Operações com constantes",
  "items": [{ "exercise": "0192f7a4-6c1e-7b3a-9d2e-5f8a1c3b7e90", "number": "1", "parts": ["a"] }],
  "source": { "kind": "authored", "license": "CC-BY-SA-4.0", "authors": ["Vértice"] },
  "visibility": "public"
}
